{
  "schema_version": "1.0",
  "checkpoint_id": "77777777-7777-4777-8777-777777777777",
  "job_id": "33333333-3333-4333-8333-333333333333",
  "owner_id": "44444444-4444-4444-8444-444444444444",
  "input_version": 1,
  "execution_fence": 1,
  "owner_deletion_epoch": 0,
  "checkpoint_ref": "88888888-8888-4888-8888-888888888888"
}
